{
  "schema": {"name": "mollification-protocol", "version": 1},
  "name": "layer-stack-p1-mollification-adequacy-v1",
  "seed": 20260825,
  "base_corpus_uri": "artifacts/corpus/layer-stack-p1-v1.json",
  "representative_states": [
    {"role": "diffuse-control", "state_id": "1b6dc2ae36e7fb076e1942242317b9af5b8bc723d71e17e5bccf33402403c49f"},
    {"role": "narrow-conductor-peak", "state_id": "3d925881a55b0bbee135592d539b71dec694be51852793d74071d68d161ce5b5"},
    {"role": "tail-three-layer-conductor", "state_id": "bd6de2e9d0cf5b32e6259d90af99b718983783cbfff1a0a9c3025a54ff3672db"},
    {"role": "tail-four-layer-diffuse-a", "state_id": "6fff05aa8f142b26631bd354c21c871e900a75bbd0f33e8426d3e05d73b9a3e9"},
    {"role": "tail-four-layer-sheen", "state_id": "4ebd9258461716ed23d523a0b221d015feb190270471e2a55b63c3a219fcb1e7"},
    {"role": "tail-four-layer-diffuse-b", "state_id": "1796065779d0932fe7ded3cc2c40b84a8a19190dd7e68732f06bc518ae7fe54a"}
  ],
  "anchor_selection": {
    "dense_view_count": 4,
    "light_roles": ["peak", "shoulder", "grazing-light", "background"],
    "shoulder_degrees": [2.0, 5.0],
    "grazing_light_z": [0.02, 0.15],
    "background_light_z": [0.4, 0.8],
    "fallback": "nearest-band-center-then-source-index-v1"
  },
  "curriculum": {
    "progress": [0.0, 0.25, 0.5, 0.75],
    "radius_degrees": [10.0, 8.535533905932738, 5.0, 1.4644660940672627],
    "zero_radius_switch_progress": 0.875,
    "jitter_count": 256,
    "sequence": "scrambled-hammersley-upper-cap-v1",
    "mollified_direction": "wo"
  },
  "reference_budget": {
    "replica_count": 2,
    "audit_paths_per_jitter_per_replica": 512,
    "maximum_path_depth": 64,
    "maximum_dispatch_queries": 4096
  },
  "reconstruction": {
    "source_role": "train",
    "embedding": "scaled-wo-wi-chord-v1",
    "neighbors": 32,
    "shepard_power": 2.0,
    "support_wo_degrees": 2.0,
    "support_wi_degrees": 1.0
  },
  "adequacy_gates": {
    "support_fraction_minimum": 0.95,
    "fresh_relative_se_p95_maximum": 0.04,
    "normalized_rgb_l1_median_maximum": 0.025,
    "normalized_rgb_l1_p95_maximum": 0.05,
    "normalized_rgb_l1_worst_maximum": 0.10,
    "normalization_floor": 1e-6,
    "repeat_float_tolerance": 1e-7
  },
  "supplement": {
    "name": "layer-stack-p1-mollification-v1",
    "view_count": 8,
    "light_count": 64,
    "peak_light_count": 16,
    "log_response_light_count": 16,
    "proposal_index_light_count": 32,
    "initial_paths_per_jitter_per_replica": 64,
    "maximum_paths_per_jitter_per_replica": 512,
    "target_relative_se_p95": 0.06,
    "maximum_group_relative_se": 0.25,
    "normalization_floor": 1e-6,
    "shard_format": {"name": "mollified-reference-shard", "version": 1},
    "corpus_format": {"name": "mollified-reference-corpus", "version": 1}
  }
}
